{
  "graph_hash": "472b64362c58363c50a1ed91865f37f145027782c338d7e099083d244277c3c6",
  "graph_id": "qi-movie-production-artifact-dependencies",
  "graph_version": 2,
  "registry_hash": "3550a35c28759a586c359178d597cfa26e2fe2358a47b242f587fce9e4cfaec4",
  "rules": [
    {
      "from": {
        "key": "source.revision",
        "kind": "FACT"
      },
      "relation": "SATISFIES_REQUIREMENT",
      "required": true,
      "rule_id": "r001-source-canon-lock",
      "scope_mode": "TITLE_WIDE",
      "to": {
        "key": "CANON_LOCK",
        "kind": "ARTIFACT_TYPE"
      }
    },
    {
      "from": {
        "key": "source.revision",
        "kind": "FACT"
      },
      "relation": "DEPENDS_MATERIALLY",
      "required": true,
      "rule_id": "r002-source-change-review",
      "scope_mode": "TITLE_WIDE",
      "to": {
        "key": "CHANGE_IMPACT_REVIEW",
        "kind": "ARTIFACT_TYPE"
      }
    },
    {
      "from": {
        "key": "source.revision",
        "kind": "FACT"
      },
      "relation": "DEPENDS_MATERIALLY",
      "required": true,
      "rule_id": "r003-source-treatment",
      "scope_mode": "TITLE_WIDE",
      "to": {
        "key": "TREATMENT",
        "kind": "ARTIFACT_TYPE"
      }
    },
    {
      "from": {
        "key": "source.revision",
        "kind": "FACT"
      },
      "relation": "DERIVES_EXACTLY",
      "required": true,
      "rule_id": "r004-source-one-liner",
      "scope_mode": "TITLE_WIDE",
      "to": {
        "key": "ONE_LINER",
        "kind": "ARTIFACT_TYPE"
      }
    },
    {
      "from": {
        "key": "source.revision",
        "kind": "FACT"
      },
      "relation": "DERIVES_EXACTLY",
      "required": true,
      "rule_id": "r005-source-breakdown",
      "scope_mode": "TITLE_WIDE",
      "to": {
        "key": "SCRIPT_BREAKDOWN",
        "kind": "ARTIFACT_TYPE"
      }
    },
    {
      "from": {
        "key": "canon.revision",
        "kind": "FACT"
      },
      "relation": "SATISFIES_REQUIREMENT",
      "required": true,
      "rule_id": "r006-canon-lock",
      "scope_mode": "TITLE_WIDE",
      "to": {
        "key": "CANON_LOCK",
        "kind": "ARTIFACT_TYPE"
      }
    },
    {
      "from": {
        "key": "canon.revision",
        "kind": "FACT"
      },
      "relation": "DEPENDS_MATERIALLY",
      "required": true,
      "rule_id": "r007-canon-shot-list",
      "scope_mode": "TITLE_WIDE",
      "to": {
        "key": "SHOT_LIST",
        "kind": "ARTIFACT_TYPE"
      }
    },
    {
      "from": {
        "key": "canon.revision",
        "kind": "FACT"
      },
      "relation": "DEPENDS_MATERIALLY",
      "required": true,
      "rule_id": "r008-canon-wardrobe",
      "scope_mode": "TITLE_WIDE",
      "to": {
        "key": "WARDROBE_LIST",
        "kind": "ARTIFACT_TYPE"
      }
    },
    {
      "from": {
        "key": "canon.revision",
        "kind": "FACT"
      },
      "relation": "DEPENDS_MATERIALLY",
      "required": true,
      "rule_id": "r009-canon-props",
      "scope_mode": "TITLE_WIDE",
      "to": {
        "key": "PROPS_LIST",
        "kind": "ARTIFACT_TYPE"
      }
    },
    {
      "from": {
        "key": "canon.revision",
        "kind": "FACT"
      },
      "relation": "DEPENDS_MATERIALLY",
      "required": true,
      "rule_id": "r010-canon-hmu",
      "scope_mode": "TITLE_WIDE",
      "to": {
        "key": "HMU_REFERENCE",
        "kind": "ARTIFACT_TYPE"
      }
    },
    {
      "from": {
        "key": "canon.revision",
        "kind": "FACT"
      },
      "relation": "DEPENDS_MATERIALLY",
      "required": true,
      "rule_id": "r011-canon-mood",
      "scope_mode": "TITLE_WIDE",
      "to": {
        "key": "MOOD_BOARD",
        "kind": "ARTIFACT_TYPE"
      }
    },
    {
      "from": {
        "key": "canon.revision",
        "kind": "FACT"
      },
      "relation": "DEPENDS_MATERIALLY",
      "required": true,
      "rule_id": "r012-canon-look",
      "scope_mode": "TITLE_WIDE",
      "to": {
        "key": "LOOK_BOOK",
        "kind": "ARTIFACT_TYPE"
      }
    },
    {
      "from": {
        "key": "TREATMENT",
        "kind": "ARTIFACT_TYPE"
      },
      "relation": "DEPENDS_MATERIALLY",
      "required": true,
      "rule_id": "r013-treatment-mood",
      "scope_mode": "TITLE_WIDE",
      "to": {
        "key": "MOOD_BOARD",
        "kind": "ARTIFACT_TYPE"
      }
    },
    {
      "from": {
        "key": "MOOD_BOARD",
        "kind": "ARTIFACT_TYPE"
      },
      "relation": "DEPENDS_MATERIALLY",
      "required": true,
      "rule_id": "r014-mood-look",
      "scope_mode": "TITLE_WIDE",
      "to": {
        "key": "LOOK_BOOK",
        "kind": "ARTIFACT_TYPE"
      }
    },
    {
      "from": {
        "key": "LOOK_BOOK",
        "kind": "ARTIFACT_TYPE"
      },
      "relation": "DEPENDS_MATERIALLY",
      "required": true,
      "rule_id": "r015-look-colour",
      "scope_mode": "TITLE_WIDE",
      "to": {
        "key": "COLOUR_PALETTE",
        "kind": "ARTIFACT_TYPE"
      }
    },
    {
      "from": {
        "key": "SCRIPT_BREAKDOWN",
        "kind": "ARTIFACT_TYPE"
      },
      "relation": "DERIVES_EXACTLY",
      "required": true,
      "rule_id": "r016-breakdown-schedule",
      "scope_mode": "TITLE_WIDE",
      "to": {
        "key": "PRODUCTION_SCHEDULE",
        "kind": "ARTIFACT_TYPE"
      }
    },
    {
      "from": {
        "key": "SCRIPT_BREAKDOWN",
        "kind": "ARTIFACT_TYPE"
      },
      "relation": "DERIVES_EXACTLY",
      "required": true,
      "rule_id": "r017-breakdown-stripboard",
      "scope_mode": "TITLE_WIDE",
      "to": {
        "key": "STRIPBOARD",
        "kind": "ARTIFACT_TYPE"
      }
    },
    {
      "from": {
        "key": "SCRIPT_BREAKDOWN",
        "kind": "ARTIFACT_TYPE"
      },
      "relation": "DEPENDS_MATERIALLY",
      "required": true,
      "rule_id": "r018-breakdown-shot-list",
      "scope_mode": "TITLE_WIDE",
      "to": {
        "key": "SHOT_LIST",
        "kind": "ARTIFACT_TYPE"
      }
    },
    {
      "from": {
        "key": "SCRIPT_BREAKDOWN",
        "kind": "ARTIFACT_TYPE"
      },
      "relation": "DEPENDS_MATERIALLY",
      "required": true,
      "rule_id": "r019-breakdown-budget",
      "scope_mode": "TITLE_WIDE",
      "to": {
        "key": "PRODUCTION_BUDGET",
        "kind": "ARTIFACT_TYPE"
      }
    },
    {
      "from": {
        "key": "SCRIPT_BREAKDOWN",
        "kind": "ARTIFACT_TYPE"
      },
      "relation": "DEPENDS_MATERIALLY",
      "required": true,
      "rule_id": "r020-breakdown-equipment",
      "scope_mode": "TITLE_WIDE",
      "to": {
        "key": "EQUIPMENT_LIST",
        "kind": "ARTIFACT_TYPE"
      }
    },
    {
      "from": {
        "key": "SCRIPT_BREAKDOWN",
        "kind": "ARTIFACT_TYPE"
      },
      "relation": "DEPENDS_MATERIALLY",
      "required": true,
      "rule_id": "r021-breakdown-wardrobe",
      "scope_mode": "TITLE_WIDE",
      "to": {
        "key": "WARDROBE_LIST",
        "kind": "ARTIFACT_TYPE"
      }
    },
    {
      "from": {
        "key": "SCRIPT_BREAKDOWN",
        "kind": "ARTIFACT_TYPE"
      },
      "relation": "DEPENDS_MATERIALLY",
      "required": true,
      "rule_id": "r022-breakdown-props",
      "scope_mode": "TITLE_WIDE",
      "to": {
        "key": "PROPS_LIST",
        "kind": "ARTIFACT_TYPE"
      }
    },
    {
      "from": {
        "key": "SCRIPT_BREAKDOWN",
        "kind": "ARTIFACT_TYPE"
      },
      "relation": "DEPENDS_MATERIALLY",
      "required": true,
      "rule_id": "r023-breakdown-hmu",
      "scope_mode": "TITLE_WIDE",
      "to": {
        "key": "HMU_REFERENCE",
        "kind": "ARTIFACT_TYPE"
      }
    },
    {
      "from": {
        "key": "SCRIPT_BREAKDOWN",
        "kind": "ARTIFACT_TYPE"
      },
      "relation": "DEPENDS_MATERIALLY",
      "required": true,
      "rule_id": "r024-breakdown-art",
      "scope_mode": "TITLE_WIDE",
      "to": {
        "key": "ART_DEPARTMENT_BREAKDOWN",
        "kind": "ARTIFACT_TYPE"
      }
    },
    {
      "from": {
        "key": "SHOT_LIST",
        "kind": "ARTIFACT_TYPE"
      },
      "relation": "DEPENDS_MATERIALLY",
      "required": true,
      "rule_id": "r025-shot-storyboards",
      "scope_mode": "TITLE_WIDE",
      "to": {
        "key": "STORYBOARDS",
        "kind": "ARTIFACT_TYPE"
      }
    },
    {
      "from": {
        "key": "SHOT_LIST",
        "kind": "ARTIFACT_TYPE"
      },
      "relation": "DEPENDS_MATERIALLY",
      "required": true,
      "rule_id": "r026-shot-equipment",
      "scope_mode": "TITLE_WIDE",
      "to": {
        "key": "EQUIPMENT_LIST",
        "kind": "ARTIFACT_TYPE"
      }
    },
    {
      "from": {
        "key": "PRODUCTION_SCHEDULE",
        "kind": "ARTIFACT_TYPE"
      },
      "relation": "DERIVES_EXACTLY",
      "required": true,
      "rule_id": "r027-schedule-call-sheet",
      "scope_mode": "TITLE_WIDE",
      "to": {
        "key": "CALL_SHEET",
        "kind": "ARTIFACT_TYPE"
      }
    },
    {
      "from": {
        "key": "PRODUCTION_SCHEDULE",
        "kind": "ARTIFACT_TYPE"
      },
      "relation": "DERIVES_EXACTLY",
      "required": true,
      "rule_id": "r028-schedule-dood",
      "scope_mode": "TITLE_WIDE",
      "to": {
        "key": "DAY_OUT_OF_DAYS",
        "kind": "ARTIFACT_TYPE"
      }
    },
    {
      "from": {
        "key": "PRODUCTION_SCHEDULE",
        "kind": "ARTIFACT_TYPE"
      },
      "relation": "DEPENDS_MATERIALLY",
      "required": true,
      "rule_id": "r029-schedule-catering",
      "scope_mode": "TITLE_WIDE",
      "to": {
        "key": "CATER_CRAFT_ORDER",
        "kind": "ARTIFACT_TYPE"
      }
    },
    {
      "from": {
        "key": "PRODUCTION_SCHEDULE",
        "kind": "ARTIFACT_TYPE"
      },
      "relation": "DEPENDS_MATERIALLY",
      "required": true,
      "rule_id": "r030-schedule-travel",
      "scope_mode": "TITLE_WIDE",
      "to": {
        "key": "TRAVEL_ACCOMMODATION",
        "kind": "ARTIFACT_TYPE"
      }
    },